"Commonly used CCA classes, their descriptions and rates",Unnamed: 1,Unnamed: 2
Class,Rate (%),Description
1,4,"Most buildings you bought after 1987 and the cost of certain additions or alterations made after 1987. The rate for eligible non-residential buildings acquired after March 18, 2007, and used in Canada to manufacture and process goods for sale or lease includes an additional allowance of 6% (total 10%). For all other eligible non-residential buildings in this class, the rate includes an additional allowance of 2% (total 6%). To be eligible for the additional allowances, elections have to be filed. For more information, go to Class 1 (4%)."
3,5,"Most buildings acquired before 1988 (or 1990, under certain conditions). Also include the cost of additions or alterations made after 1987. For more information, go to Class 3 (5%)."
6,10,"Frame, log, stucco on frame, galvanized iron or corrugated metal buildings that meet certain conditions. Class 6 also includes certain fences and greenhouses. For more information, go to Class 6 (10%)."
8,20,"Property that you use in your business and that is not included in another class. Also included is data network infrastructure equipment and systems software for that equipment acquired before March 23, 2004. Some buildings used for storage should also be included. For more information, go to Class 8 (20%) and Class 46 (30%)."
10,30,"General-purpose electronic data-processing equipment (commonly called computer hardware) and systems software for that equipment acquired before March 23, 2004, or after March 22, 2004, and before 2005 if you made an election. Also included are motor vehicles and some passenger vehicles. For more information, go to Class 10 (30%) and Class 10.1 (30%)."
10.1,30,"A passenger vehicle not included in Class 10. For more information, go to Class 10.1 (30%)."
12,100,"Property such as tools, medical or dental instruments, and kitchen utensils that cost less than $500 and were acquired after May 1, 2006. For more information, go to Class 12 (100%)."
13,Varies,"Leasehold interest. You can claim CCA on a leasehold interest, but the maximum rate depends on the type of leasehold interest and the terms of the lease."
14,Varies,"Patents, franchises, concessions or licences for a limited period. Your CCA is the lesser of the total of the capital cost of each property spread out over the life of the property, or the undepreciated capital cost to the taxpayer as of the end of the tax year of property of that class."
14.1,5,"Starting January 1, 2017, include in Class 14.1Footnote1 property that:"
,,is goodwill
,,"was eligible capital property immediately before January 1, 2017, and is owned at the beginning of that day"
,,"is acquired after 2016, other than:"
,,property that is tangible or corporeal property
,,property that is not acquired for the purpose of gaining or producing income from business
,,property in respect of which any amount is deductible (otherwise than as a result of being included in Class 14.1) in computing the income from the business
,,an interest in a trust
,,an interest in a partnership
,,"a share, bond, debenture, mortgage, hypothecary claim, note, bill or other similar property"
,,"property that is an interest in, or for civil law a right in, or a right to acquire, a property described in any of the above sub-bullets"
,,Examples for farming are milk and eggs quotas.
,,"Examples for business, professional and fishing are franchises, concessions or licences for an unlimited period."
,,Properties that are included in Class 14.1 and acquired after 2016 will be included in this class at a 100% inclusion rate with a 5% CCA rate on a declining-balance basis and the existing CCA rules will normally apply.
,,"For tax years that end prior to 2027, properties included in Class 14.1 that were acquired before January 1, 2017, will be depreciable at a CCA rate of 7% instead of 5%. Transitional rules will apply."
16,40,"Taxis acquired after May 25, 1976, vehicles acquired after November 12, 1981, that you use in a daily car-rental business, coin-operated video games or pinball machines acquired after February 15, 1984, and freight trucks acquired after December 6, 1991, that are rated higher than 11,788 kilograms."
17,8,"Roads, parking lots, sidewalks, airplane runways, storage areas or similar surface construction, as well as telephone, telegraph or non-electric data communication switching equipment."
29,Varies,"Eligible machinery and equipment used in Canada to manufacture and process goods for sale or lease, acquired after March 18, 2007, and before 2016, that would otherwise be included in Class 43."
38,30,"Most power-operated movable equipment you bought after 1987 that was use for excavating, moving, placing or compacting earth, rock, concrete or asphalt.Footnote2"
43,30,"Eligible machinery and equipment used in Canada to manufacture and process goods for sale or lease that are not included in Class 29 or 53. For more information, go to Class 43 (30%)."
43.1,30,"Certain clean energy generation and energy conservation equipment not included in Class 43.2, including electric vehicle charging stations set up to supply more than 10 kilowatts but less than 90 kilowatts of continuous power. For more information, go to Class 43.1 (30%) and Class 43.2 (50%)."
43.2,50,"Certain clean energy generation and energy conservation equipment acquired after February 22, 2005, and before 2025. For more information, go to Class 43.1 (30%) and Class 43.2 (50%)."
44,25,"Patents or licences to use patents for a limited or unlimited period that were acquired after April 26, 1993. However, you can elect not to include such property in Class 44 by attaching a letter to the return for the year you acquired the property. In the letter, indicate the property you don't want to include in Class 44. For more information, go to Class 44 (25%)."
45,45,"General-purpose electronic data-processing equipment (computer hardware) and systems software for that equipment, including ancillary data-processing equipment, if you acquired them after March 22, 2004, and before March 19, 2007."
46,30,"Data network infrastructure equipment and systems software for that equipment acquired after March 22, 2004. If acquired before March 23, 2004, include them in Class 8 (20%)."
50,55,"General-purpose electronic data-processing equipment (computer hardware) and systems software for that equipment, including ancillary data-processing equipment, acquired after March 18, 2007, and not included in Class 29 or 52. For more information, go to Class 50 (55%)."
52,100,"General-purpose electronic data-processing equipment (computer hardware) and systems software for that equipment, including ancillary data-processing equipment, if you acquired them after January 27, 2009, and before February 2011."
53,50,Machinery and equipment acquired after 2015 and before 2026 that is used in Canada mainly to manufacture and process goods for sale or lease.
54,30,"Zero-emission vehicles acquired after March 18, 2019, that would otherwise be included in Class 10 or 10.1. These vehicles may be eligible for the first-year enhanced CCA deduction with a phase-out period. There is a limit on the capital cost for each zero-emission passenger vehicle ($55,000 if acquired before 2022, $59,000 if acquired in 2022 and $61,000 if acquired after 2022). For more information, go to Class 54 (30%) and Class 55 (40%). "
55,40,"Zero-emission vehicles acquired after March 18, 2019, that would otherwise be included in Class 16. These vehicles may be eligible for the first-year enhanced CCA deduction with a phase-out period. For more information, go to Class 54 (30%) and Class 55 (40%). "
56,30,"Zero-emission automotive equipment and vehicles (other than motor vehicles) that don't currently benefit from the accelerated rate provided by Classes 54 and 55. They must be acquired after March 1, 2020, and become available for use before 2028. They may be eligible for the first-year enhanced CCA deduction with a phase-out period. For more information, go to Class 56 (30 %)."
57,8,"Equipment that is used solely to capture, transport or store carbon dioxide (CO2) as part of a carbon capture, utilization and storage project."
58,20,Equipment that is used solely to use carbon dioxide (CO2) in industrial production.
59,100,"Intangible property acquired after 2021 for determining the existence, location, extent or quality of a geological formation to permanently store captured carbon in Canada, including property acquired as a result of undertaking environmental studies or community consultations."
60,30,"Intangible property acquired after 2021 for drilling, converting or completing a well in Canada to permanently store captured carbon."
,,
,,
,,
,, 
Pipelines,,
"15. Depending on its use, a pipeline may be included in Class 1, 8, 41 or 49, as the case may be. A pipeline acquired by a taxpayer that is not",,
"(a) gas or oil well equipment – Class 41 (see ¶s 3-4),",,
"(b) Canadian field processing equipment – Class 41 (see ¶ 6),",,
"(c) a new pipeline acquired after February 22, 2005 used for the transmission of petroleum, natural gas or related hydrocarbons – Class 49 (see ¶ 17), or",,
"(d) a pipeline for which the CRA, in consultation with the Minister of Natural Resources, is satisfied that the main source of supply is likely to be exhausted within 15 years of it becoming operational – Class 8 by virtue of paragraph (i) thereof",,
will be included in Class 1 by virtue of paragraph (l) thereof.,,
"Note: The 2007 Federal Budget proposes that a new pipeline, including control and monitoring devices, valves and other equipment ancillary to the pipeline, used for the distribution (but not the transmission) of natural gas that is acquired after March 18, 2007 be included in new Class 51 which will have a CCA rate of 6 per cent on a declining balance basis. The 2008 Federal Budget proposes that a new pipeline used for the transmission of carbon dioxide that is acquired after February 25, 2008 be included in Class 49.",,
16. Examples of pipelines included in paragraph (l) of Class 1 are as follows:,,
"pipelines (other than new pipelines eligible for Class 49 – see ¶ 17 ) used for the transmission of petroleum, natural gas or related hydrocarbons;",,
"pipelines used to transmit oil from the primary separator to the transmission line or to an oil processing plant (i.e., refinery);",,
"in the case of heavy crude oil, a pipeline used to transport condensate to the field blending facilities;",,
pipelines from the primary separator in a gas field to the transmission line (other than a pipeline used solely to transmit natural gas to a natural gas processing plant – see ¶s 3 and 4);,,
pipelines from a gas processing plant to the transmission line;,,
a water supply pipeline from a river or any other source to a gas processing plant;,,
pipelines (other than new pipelines eligible for Class 49 – see ¶ 17 ) used to transmit natural gas to a straddle plant. Such pipelines are considered to be used primarily for transmitting the gas to market;,,
product sales lines from a gas processing plant to loading facilities or a transmission line;,,
liquefied petroleum gas and ethane pipelines from a gas processing plant to storage facilities; and,,
"pipelines used for the distribution of petroleum, natural gas or related hydrocarbons. [See note at the end of paragraph 15].",,
"Attachments to a pipeline that are considered to be an integral and component part of a pipeline (e.g., valves, control devices, branches, extensions, racks) will be included in the same CCA class as the pipeline of which they are a part.",,
"For comments concerning linefill in a pipeline and the capital cost of a pipeline, see the current version of IT-482, Pipelines.",,
"17. Class 49 includes property acquired after February 22, 2005 that is a pipeline, including control and monitoring devices, valves and other equipment ancillary to the pipeline, used for the transmission (but not the distribution) of petroleum, natural gas or related hydrocarbons. This is a functional determination as to whether a pipeline is used for the transmission of a product. Therefore, for example, a pipeline used in the transmission phase of a company’s business that consists primarily of the distribution of gas, may qualify for inclusion in Class 49. Similarly, a pipeline used to transmit natural gas to a straddle plant may be included in this class.",,
"However, only property that has not been used or acquired for use for any purpose by any taxpayer before February 23, 2005 is eligible to be included in Class 49. Eligible property does not include",,
"pipelines described in ¶ 15(d) above,",,
"a building or structure, or",,
pipeline appendages (see ¶s 18 to 24).,,
"A separate class election, which must be made for the taxation year in which the property is acquired, is available under subsection 1101(5v) of the Regulations for Class 49 property. Although this separate class election does not change the CCA rate for such property, it does provide that any terminal loss or recapture will be realized at the time of disposition.",,
"As indicated in the Note at the end of ¶ 15, it is proposed that a new pipeline used for the transmission of carbon dioxide that is acquired after February 25, 2008 be included in Class 49.",,
Pipeline Appendages,,
"18. Where an attachment to a pipeline is not an integral and component part of the pipeline, it is considered to be separate equipment from that of the pipeline (a “pipeline appendage”). For further information and examples, see the current version of IT-482.",,
"19. Except as noted in ¶ 24(a), where a pipeline is included in Class 41 (see ¶ 15(a) and (b)), any appendage to it will also be included in that class.",,
20. A pipeline appendage acquired by a taxpayer that is not included in Class 41 as described in ¶ 19 will be included in,,
"Class 7 by virtue of paragraph (j) thereof, if it is pumping, compression or any ancillary equipment acquired after February 22, 2005 related to a transmission pipeline for petroleum, natural gas or related hydrocarbons (see ¶ 21);",,
"Class 8 by virtue of paragraph (i) thereof, if it is a compressor station acquired before February 23, 2005 that is used",,
,,
"(a) for the transmission of natural gas from a gas field or gas plant to a transmission pipeline, or",,
"(b) in conjunction with a transmission pipeline,",,
but is not used in conjunction with the distribution of natural gas (see ¶ 22);,,
"Class 8 by virtue of paragraph (i) thereof, if it is used for the transmission or distribution of crude oil and it is not included in paragraph (j) of Class 7; or",,
"Class 1 by virtue of paragraph (n) thereof, if it is acquired primarily for the distribution of natural gas and it is not included in paragraph (j) of Class 7 (see ¶s 21 to 24).",,
"Note: The 2008 Federal Budget proposes that any pumping, compression or ancillary equipment acquired after February 25, 2008 that is on a carbon dioxide transmission pipeline be included in Class 7.",,
"21. Paragraph(j) of Class 7 includes pumping and compressing equipment that pumps or compresses petroleum, natural gas or related hydrocarbons for the purpose of moving it",,
"through a transmission pipeline,",,
"from a transmission pipeline to a storage facility, or",,
to a transmission line from a storage facility.,,
"This class will include certain property acquired after February 22, 2005 that would have previously been included in Class 1 by virtue of paragraph (n) thereof (see ¶ 24) since property described in Class 1 is included in that class only if it is not included in any other class (such as Class 7).",,
"A separate class election, which must be made for the taxation year in which the property is acquired, is available under subsection 1101(5u) of the Regulations for property included in Class 7 by virtue of paragraph (j) thereof. Although this separate class election does not change the CCA rate for such property, it does provide that any remaining balance of undepreciated capital cost in the class after the disposition of the property, can in the year of disposition, be fully deducted as a terminal loss.",,
"22. Paragraph 8 of archived Interpretation Bulletin IT‑482, Capital Cost Allowance – Pipelines, dated November 1, 1981, indicated that:",,
"“A compressor station that is used in the transmission of natural gas from a gas field or a gas plant to a transmission pipeline, or that is used in conjunction with a main transmission pipeline, is included in Class 8. A compressor station that is used in conjunction with the distribution of gas is included in class 2 by virtue of paragraph (d) thereof [now paragraph (n) of Class 1].”",,
"This bulletin was issued before the Federal Court of Appeal (FCA) decisions in Northern and Central Gas Corporation v. The Queen,87 DTC 5439, [1987] 2 CTC 241 and Pacific Northern Gas Limited v. The Queen, 91 DTC 5287, [1991] 1 CTC 469 (see ¶ 23). Prior to the FCA’s decision in Northern and Central Gas Corporation, a Special Release to IT-482 dated February 28, 1986 was issued which indicated that the position in ¶ 8 of the bulletin would continue to be followed pending the outcome of the appeal of the case. However, for a number of reasons, the bulletin was not revised once that decision was released. Therefore, notwithstanding the view expressed in ¶ 23,the CRA will maintain the position in ¶ 8 of IT-482 that compressor stations used in the transmission of natural gas or in conjunction with a transmission pipeline acquired before February 23, 2005 will be included in Class 8. Such compressor stations acquired after February 22, 2005 will be included in Class 7 by virtue of paragraph (j) thereof (see ¶s 20 and 21).",,
"In interpreting the words in the second sentence in ¶ 8 of IT‑482, “A compressor station that is used in conjunction with the distribution of gas…”, the CRA has generally adopted a “main purpose approach” rather than a functional approach to the classification of natural gas pipeline compressors. For example, compressors that form part of a taxpayer’s transmission system that is used primarily in the taxpayer’s business of distributing natural gas would be included in paragraph (n) of Class 1 and not in Class 8. Distribution of natural gas includes deliveries to the ultimate consumers, regardless of whether they are residential, commercial or industrial and whether or not the taxpayer is the owner of the natural gas being distributed.",,
"23. Paragraph (n) of Class 1 generally includes property that is manufacturing and distributing equipment and plant (including structures) acquired primarily for the production or distribution of gas. Based on the decisions of the courts in Northern and Central Gas and Pacific Northern Gas Limited, it is the CRA’s view that the words “distributing equipment and plant” and “distribution of gas” as used in paragraph (n) of Class 1 should be interpreted in a broad and general sense and should not be given the more restrictive meaning used by the natural gas industry to distinguish between a natural gas transmission system and a natural gas distribution system.",,
24. Examples of pipeline appendages that would generally be included in Class 1 by virtue of paragraph (n) thereof are as follows:,,
(a) pipeline appendages attached to a pipeline used solely for transmitting gas to a natural gas processing plant (Note: they do not qualify as gas or oil well equipment);,,
"(b) compressors acquired before February 23, 2005 that are used primarily in the taxpayer’s business of distributing natural gas (see ¶s 22 and 23); and",,
"(c) liquefied natural gas (LNG) facilities and related storage facilities (other than designated underground storage costs). (See the decision in Northern and Central Gas Corporation.) LNG facilities include facilities which liquefy the natural gas prior to shipment, those which regasify it after transport and those that liquefy natural gas for storage during periods of low demand and regasify it for use during periods of high demand.",,
"However, where the pipeline appendages referred to in paragraphs a) and b) above are pumping, compression and any ancillary equipment related to a transmission pipeline for natural gas acquired after February 22, 2005, they will be included in Class 7 by virtue of paragraph (j) thereof (see ¶ 21).",,
"Note: The 2007 Federal Budget proposes that eligible equipment acquired after March 18, 2007 that is part of an LNG facility that liquefies or regasifies natural gas be included in Class 47, which has a CCA rate of 8 per cent. Eligible equipment will include controls, cooling equipment, compressors, pumps, storage tanks, vaporizers and ancillary equipment, loading and unloading pipelines on the facility site used to transport the LNG between a ship and the facility and related structures; but will not include a building, breakwater, dock, jetty, wharf or similar structure, or property acquired for the purpose of producing oxygen or nitrogen.",,
Other CCA Classes,,
"25. Generally, buildings or other structures are included in Class 1. However, certain buildings that have no footings or any other base support below ground level are included in Class 6. In addition, as noted in ¶ 11, buildings or other structures may qualify for inclusion in subparagraph (b)(i) of Class 41 because they are described in paragraph (g) of Class 10. For further information, see the current version of IT-79, Capital Cost Allowance – Buildings or Other Structures.",,
"26. Depreciable property (such as a service rig) used in the completion, re-completion or work-over of an oil or gas well will generally be included in either paragraph (a) of Class 10 or paragraph (i) of Class 8. Generally, automotive service rigs are included in Class 10 by virtue of paragraph (a) thereof and non-automotive service rigs are in Class 8 by virtue of paragraph (i) thereof. For a discussion of CCA in respect of offshore drilling rigs, see the current version of IT‑267, Capital Cost Allowance – Vessels.",,
"27. Pursuant to paragraph 13(7.5)(b) of the Act and subsection 1102(14.3) of the Regulations, where a taxpayer has incurred costs on account of capital for the building of or right to use roads, parking areas, storage areas or similar surface construction and the amount of these costs would not otherwise be included in the capital cost to the taxpayer of depreciable property, the taxpayer is considered to have acquired a depreciable property having a capital cost equal to the amount of such costs. The capital cost of such property would be included in the undepreciated capital cost of property of Class 17 by virtue of paragraph (c) thereof.",,
Schedules,,
"28. The schedules appended to this bulletin indicate the appropriate CCA classification of certain equipment used in P and NG activities, as well as certain expenditures that qualify as either Canadian exploration expense (“CEE”) (as defined in subsection 66.1(6)) or Canadian development expense (“CDE”) (as defined in subsection 66.2(5)). In addition to Class 41 assets, the schedules also describe some of the assets that are included in Classes 1, 6, 7, 8, 17, 43 and 49. Since the classification of certain assets used in bituminous sands projects is described in ¶s 10-14, they are not included in the schedules.",,
Exclusions from Depreciable Property,,
"29. A “specified temporary access road” (as defined in subsection 1104(2) of the Regulations) is generally a road built for temporary access to an oil or gas well in Canada in the course of drilling or completing such well. It is excluded from Class 17 by virtue of paragraph (c) thereof and excluded from Class 8 by virtue of subparagraph (i)(vi) thereof. Since it is not depreciable property of a prescribed class, the cost of a specified temporary access road may qualify as CEE or CDE provided that other requirements of those provisions are met.",,
"30. An “oil or gas well” (as defined in subsection 248(1)), including well casing and cementing, is not considered to be “gas or oil well equipment” and it is also excluded from Class 8 by virtue of subparagraph (i)(iv) thereof. An oil or gas well in Canada is a “Canadian resource property” (as defined in subsection 66(15)), the cost of which qualifies as “Canadian oil and gas property expense” (as defined in subsection 66.4(5)).",,
Depreciable Property Excluded from CEE and CDE,,
"31. Pursuant to paragraph (k.1) of the definition of CEE in subsection 66.1(6) and paragraph (i.1) of the definition of CDE in subsection 66.2(5), the CEE and CDE of a taxpayer do not include an expense that is a cost, or any part of the cost, to the taxpayer of any depreciable property of a prescribed class that was acquired after 1987. Other provisions dealing with the treatment of depreciable property vs. resource expenses (e.g., CEE and CDE) are",,
"for taxation years that end after 1987 and before December 6, 1996 — subsection 13(34), and",,
"for taxation years that end after December 5, 1996 — paragraph 1102(1)(a) of the Regulations and paragraph (l) of the definition of CEE in subsection 66.1(6) and paragraph (j) of the definition of CDE in subsection 66.2(5) of the Act.",,
Calculation of CCA,,
